{
  "schema_version": 1,
  "reviewer": "reviewer-code-quality",
  "summary": "Reviewed src/parser.ts. One P2 finding: a regex backtracks catastrophically on pathological input. Fix is straightforward. No plan-level findings in scope.",
  "findings": [
    {
      "title": "Regex in parseHeader backtracks on nested quotes",
      "severity": "P2",
      "scope": {
        "kind": "code",
        "file": "src/parser.ts",
        "line": 87
      },
      "what_wrong": "The regex /\"([^\"]*)\"*/ backtracks O(2^n) on strings like '\"a\"\"a\"...'. Real user logs show a hang on imported CSVs.",
      "suggested_fix": "Use /\"([^\"]*)\"/ (no trailing star) and handle escaped quotes explicitly.",
      "evidence": "src/parser.ts:87; manual repro with payload in tests/fixtures/pathological.csv."
    }
  ],
  "residual_risks": [],
  "open_questions": []
}
